{
  "$schema": "https://json-schema.org/draft/2020-12/schema",
  "$id": "https://xianxia-engine.com/schemas/item_template.json",
  "title": "Item Template Schema",
  "description": "Schema for item template definitions",
  "type": "object",
  "required": ["meta", "item_types", "quality_tiers", "item_templates"],
  "properties": {
    "meta": {"$ref": "#/$defs/metaInfo"},
    "item_types": {
      "type": "object",
      "additionalProperties": {
        "type": "object",
        "required": ["id", "name", "stackable", "consumable"],
        "properties": {
          "id": {"type": "string"},
          "name": {"type": "string"},
          "stackable": {"type": "boolean"},
          "consumable": {"type": "boolean"},
          "slot": {
            "oneOf": [
              {"type": "null"},
              {"type": "string"},
              {"type": "array", "items": {"type": "string"}}
            ]
          }
        }
      }
    },
    "quality_tiers": {
      "type": "object",
      "additionalProperties": {
        "type": "object",
        "required": ["id", "name", "color", "value_multiplier", "drop_weight"],
        "properties": {
          "id": {"type": "integer"},
          "name": {"type": "string"},
          "color": {"type": "string", "pattern": "^#[0-9A-Fa-f]{6}$"},
          "value_multiplier": {"type": "number"},
          "drop_weight": {"type": "integer"}
        }
      }
    },
    "item_templates": {
      "type": "array",
      "items": {
        "type": "object",
        "required": ["id", "name", "item_type", "grade", "quality", "description", "value", "weight"],
        "properties": {
          "id": {"type": "string"},
          "name": {"type": "string"},
          "item_type": {"type": "string"},
          "grade": {"type": "integer"},
          "quality": {"type": "string"},
          "description": {"type": "string"},
          "icon": {"type": "string"},
          "effects": {"type": "object"},
          "base_stats": {"type": "object"},
          "bonus_stats": {"type": "object"},
          "requirements": {"type": "object"},
          "value": {"type": "integer"},
          "weight": {"type": "number"},
          "max_stack": {"type": "integer"},
          "durability": {"type": "object"},
          "enhancement": {"type": "object"},
          "set_bonus": {"type": "object"},
          "cooldown": {"type": "string"},
          "unique": {"type": "boolean"},
          "indestructible": {"type": "boolean"},
          "bind_on_equip": {"type": "boolean"}
        }
      }
    },
    "item_mechanics": {"type": "object"},
    "item_generation": {"type": "object"},
    "_custom_tags": {"$ref": "#/$defs/customTags"}
  },
  "$defs": {
    "metaInfo": {
      "type": "object",
      "required": ["version", "description", "schema_version"],
      "properties": {
        "version": {"type": "string", "pattern": "^\\d+\\.\\d+\\.\\d+$"},
        "description": {"type": "string"},
        "schema_version": {"type": "string"},
        "last_modified": {"type": "string", "format": "date"}
      }
    },
    "customTags": {
      "type": "array",
      "items": {"type": "string"}
    }
  }
}